<?xml version="1.0"?>
<bank
        xmlns:xsd="http://www.w3.org/2001/XMLSchema-instance"
        xsd:noNamespaceSchemaLocation="accounts.xsd">
    <accounts>
        <account number="123456">
            <holder>abcdefghijklmno1</holder>
            <yearOperations year="2019">
                <operation date="2019-01-01" amount="12.1"/>
            </yearOperations>
        </account>
        <account number="1234567">
            <holder>abcdefghijklmno1</holder>
            <holder>abcdefghijklmno2</holder>
            <yearOperations year="2019">
                <operation date="2019-01-01" amount="12.1"/>
            </yearOperations>
            <yearOperations year="2020">
                <operation date="2020-01-01" amount="12.1"/>
            </yearOperations>
        </account>
        <account number="12345678">
            <holder>abcdefghijklmno2</holder>
            <yearOperations year="2019">
                <operation date="2019-05-01" amount="15.55"/>
            </yearOperations>
        </account>
    </accounts>
    <holders>
        <holder name="Elia" fiscalCode="abcdefghijklmno1" address="via torino, 50"/>
        <holder name="Sandro" fiscalCode="abcdefghijklmno2" address="via milano, 10"/>
    </holders>
</bank>
